{"schema":"fleetflight/describe@1","model":{"name":"core-ref","version":"1.0","hash":"sha256:72c94caeef30"},"sut":{"id":"firmware-ref@v0.3.3","name":"firmware-ref","version":"v0.3.3"},"sut_versions":["firmware-ref@v0.3.1","firmware-ref@v0.3.2","firmware-ref@v0.3.3"],"tick_ms":50,"components":[{"id":"bms","name":"BMS","owner":"model","states":["HEALTHY","FAULTED"],"description":"Battery management system. Sends FAULT on the HEALTHY→FAULTED edge (retransmitted until ACKed) and STATUS every 2000 ms. The hub's view of it is UNKNOWN until a report arrives after a boot."},{"id":"bus","name":"Bus","owner":"model","states":["in-flight messages"],"description":"Carries every message with 50 ms latency; the adversary may delay (total <= 800 ms), drop or duplicate, which also reorders."},{"id":"hub","name":"Hub manager","owner":"sut","states":["ONLINE","RESTARTING","DEGRADED"],"description":"System under test. RESTARTING is the model's power lifecycle (400 ms, RX lost, NVM kept); the rest is firmware logic."},{"id":"inv","name":"Inverter controller","owner":"sut","states":["DISCHARGING","IDLE","SHUTDOWN"],"description":"System under test. Executes hub commands and falls back when the hub goes silent."}],"injectables":[{"name":"bms_fault","description":"BMS enters FAULTED (e.g. overtemp) and sends FAULT to the hub, retransmitted until ACKed.","params":[]},{"name":"hub_restart","description":"Hub loses power: queued RX messages are lost, it boots after 400 ms with only its NVM.","params":[]},{"name":"network_loss","description":"The hub-inverter link goes down for the rest of the run.","params":[]},{"name":"bus_delay","description":"Push one in-flight message later; total latency stays <= 800 ms.","params":[{"name":"msg","values":"any in-flight message id"},{"name":"extra_ms","values":[100,200,400,700]}]},{"name":"bus_drop","description":"Lose one in-flight message.","params":[{"name":"msg","values":"any in-flight message id"}]},{"name":"bus_dup","description":"Duplicate one in-flight message (same due time).","params":[{"name":"msg","values":"any in-flight message id (not itself a duplicate)"}]}],"invariants":[{"id":"I1","name":"FAULT_SHUTDOWN_BOUNDED","description":"If the BMS is FAULTED, the inverter stops discharging within 500 ms.","formula":"G( bms=FAULTED ∧ inv=DISCHARGING → (t − i1_since_ms) < 500 )","bound_ms":500,"timer_key":"i1_since_ms"},{"id":"I2","name":"NO_HIGH_POWER_WHEN_UNKNOWN","description":"The inverter never runs above 1000 W on a command the hub sent while it had no BMS report since its last boot (BMS state UNKNOWN to the hub).","formula":"G( inv_watts > 1000 → inv_basis ≠ UNKNOWN )","bound_ms":null,"timer_key":null},{"id":"I3","name":"NO_RESURRECTED_COMMANDS","description":"The inverter never executes a command after its expiry.","formula":"G( inv=DISCHARGING → inv_cmd.expires_ms > t )","bound_ms":null,"timer_key":null},{"id":"I4","name":"IDEMPOTENT_COMMANDS","description":"A command (epoch, seq) is applied by the inverter at most once: duplicated or reordered copies never cause a second physical action.","formula":"G( ∀(epoch,seq): applied_count(epoch,seq) ≤ 1 )","bound_ms":null,"timer_key":null},{"id":"I5","name":"COMMS_LOSS_SAFE_FALLBACK","description":"If hub messages stop reaching the inverter, it leaves DISCHARGING within 1500 ms of the last one.","formula":"G( inv=DISCHARGING ∧ silent(hub→inv) → (t − i5_since_ms) < 1500 )","bound_ms":1500,"timer_key":"i5_since_ms"}],"assumptions":["ASSUMED bus latency <= 800 ms; messages may be delayed, dropped, duplicated or reordered","ASSUMED BMS FAULT message is edge-triggered and retransmitted every 100 ms until the hub ACKs it; status heartbeat every 2000 ms","ASSUMED hub boot takes 400 ms and clears its RX buffer; only NVM survives a restart","ASSUMED shutdown budget 500 ms (a real number would come from Base's safety requirements)","ASSUMED one dispatch at t=0: DISCHARGE 5000 W, expires at 3000 ms; cloud re-dispatch after a hub restart is not modeled","ASSUMED network_loss means the hub-inverter link is down for the rest of the run","OUT OF SCOPE hardware interlocks (contactors, hardwired BMS trip)","OUT OF SCOPE core-ref is a reference model we wrote, not Base Gen 3 firmware"],"bounds":{"max_depth":120,"max_injections":3,"horizon_ms":3500},"constants":{"LATENCY_BASE_MS":50,"LATENCY_MAX_MS":800,"HUB_BOOT_MS":400,"BMS_STATUS_MS":2000,"FAULT_RETX_MS":100,"SHUTDOWN_BUDGET_MS":500,"COMMS_LOSS_BUDGET_MS":1500,"HIGH_POWER_W":1000,"DISPATCH_WATTS":5000,"DISPATCH_EXPIRES_MS":3000,"HUB_REFRESH_MS":100,"HUB_LOSS_TIMEOUT_MS":200},"snapshot_keys":[{"key":"bms","label":"BMS","lane":true},{"key":"bus","label":"Bus","lane":true},{"key":"hub","label":"Hub","lane":true},{"key":"inv","label":"Inverter","lane":true},{"key":"nvm","label":"Hub NVM","lane":false},{"key":"hub_bms","label":"BMS as seen by hub","lane":false},{"key":"link","label":"Hub-inverter link","lane":false},{"key":"inv_basis","label":"Inverter command basis","lane":false},{"key":"i1_since_ms","label":"I1 timer","lane":false},{"key":"i5_since_ms","label":"I5 timer","lane":false},{"key":"i4_repeat","label":"I4 repeated command","lane":false},{"key":"injections_left","label":"Injections left","lane":false}]}