{
  "_fixture": true,
  "schema": "fleetflight/describe@1",
  "model": {
    "name": "core-ref",
    "version": "0.0-fixture",
    "hash": "sha256:d518669da72b"
  },
  "sut": {
    "id": "firmware-ref@v0.3.1",
    "name": "firmware-ref",
    "version": "v0.3.1"
  },
  "sut_versions": [
    "firmware-ref@v0.3.1",
    "firmware-ref@v0.3.2",
    "firmware-ref@v0.3.3"
  ],
  "tick_ms": 50,
  "components": [
    {
      "id": "bms",
      "name": "BMS",
      "owner": "model",
      "states": [
        "HEALTHY",
        "FAULTED",
        "UNKNOWN"
      ],
      "description": "Battery management system. Sends FAULT once on the edge, STATUS every 2 s."
    },
    {
      "id": "bus",
      "name": "Bus",
      "owner": "model",
      "states": [
        "in-flight messages"
      ],
      "description": "Carries messages with bounded latency; the adversary may delay, drop or duplicate."
    },
    {
      "id": "hub",
      "name": "Hub",
      "owner": "sut",
      "states": [
        "ONLINE",
        "RESTARTING",
        "DEGRADED"
      ],
      "description": "Hub manager (system under test). Restart clears RX and keeps NVM."
    },
    {
      "id": "inv",
      "name": "Inverter",
      "owner": "sut",
      "states": [
        "IDLE",
        "CHARGING",
        "DISCHARGING",
        "SHUTDOWN"
      ],
      "description": "Inverter controller (system under test)."
    }
  ],
  "injectables": [
    {
      "name": "bms_fault",
      "description": "BMS enters FAULTED (e.g. overtemp).",
      "params": []
    },
    {
      "name": "hub_restart",
      "description": "Hub reboots; RX buffer lost, NVM kept.",
      "params": []
    },
    {
      "name": "bus_delay",
      "description": "Push one in-flight message later, within the latency bound.",
      "params": [
        {
          "name": "msg",
          "values": "any in-flight message id"
        },
        {
          "name": "extra_ms",
          "values": [
            100,
            200,
            300,
            400,
            500,
            600,
            700,
            800
          ]
        }
      ]
    },
    {
      "name": "bus_drop",
      "description": "Lose one in-flight message.",
      "params": [
        {
          "name": "msg",
          "values": "any in-flight message id"
        }
      ]
    },
    {
      "name": "bus_dup",
      "description": "Duplicate one in-flight message.",
      "params": [
        {
          "name": "msg",
          "values": "any in-flight message id"
        }
      ]
    }
  ],
  "invariants": [
    {
      "id": "I1",
      "name": "FAULT_SHUTDOWN_BOUNDED",
      "description": "If the BMS is FAULTED, the inverter stops discharging within 500 ms.",
      "formula": "G( bms=FAULTED ∧ inv=DISCHARGING → (t − i1_since_ms) ≤ 500 )",
      "bound_ms": 500,
      "timer_key": "i1_since_ms"
    },
    {
      "id": "I2",
      "name": "NO_HIGH_POWER_WHEN_UNKNOWN",
      "description": "While BMS state is UNKNOWN the inverter never runs above 1 kW.",
      "formula": "G( bms=UNKNOWN → inv_watts ≤ 1000 )",
      "bound_ms": null,
      "timer_key": null
    },
    {
      "id": "I3",
      "name": "NO_RESURRECTED_COMMANDS",
      "description": "The inverter never executes a command after its expiry.",
      "formula": "G( inv_cmd ≠ ∅ → inv_cmd.expires_ms > t )",
      "bound_ms": null,
      "timer_key": null
    },
    {
      "id": "I4",
      "name": "IDEMPOTENT_COMMANDS",
      "description": "A duplicated command sequence number never causes a second physical action.",
      "formula": "G( applied_count(seq) ≤ 1 )",
      "bound_ms": null,
      "timer_key": null
    },
    {
      "id": "I5",
      "name": "COMMS_LOSS_SAFE_FALLBACK",
      "description": "After losing hub commands the inverter reaches IDLE or SHUTDOWN within 1.5 s.",
      "formula": "G( no_hub_cmd → (t − i5_since_ms) ≤ 1500 )",
      "bound_ms": 1500,
      "timer_key": "i5_since_ms"
    }
  ],
  "assumptions": [
    "ASSUMED bus latency <= 800 ms; messages may be delayed, dropped, duplicated or reordered",
    "ASSUMED BMS FAULT message is edge-triggered; status heartbeat every 2000 ms",
    "ASSUMED inverter holds last setpoint 1000 ms without a hub command, then IDLE",
    "ASSUMED hub boot takes 400 ms and clears its RX buffer",
    "ASSUMED shutdown budget 500 ms",
    "OUT OF SCOPE hardware interlocks (contactors, hardwired BMS trip)"
  ],
  "bounds": {
    "max_depth": 60,
    "max_injections": 3,
    "horizon_ms": 3000
  },
  "constants": {
    "LATENCY_MAX_MS": 800,
    "HUB_BOOT_MS": 400,
    "SHUTDOWN_BUDGET_MS": 500,
    "INV_HOLD_MS": 1000
  },
  "snapshot_keys": [
    {
      "key": "bms",
      "label": "BMS",
      "lane": true
    },
    {
      "key": "bus",
      "label": "Bus",
      "lane": true
    },
    {
      "key": "hub",
      "label": "Hub",
      "lane": true
    },
    {
      "key": "inv",
      "label": "Inverter",
      "lane": true
    },
    {
      "key": "nvm",
      "label": "Hub NVM",
      "lane": false
    },
    {
      "key": "i1_since_ms",
      "label": "I1 timer",
      "lane": false
    },
    {
      "key": "i5_since_ms",
      "label": "I5 timer",
      "lane": false
    },
    {
      "key": "injections_left",
      "label": "Injections left",
      "lane": false
    }
  ]
}
